{
  "$schema": "https://rmside.invalid/schemas/profile/v1",
  "schemaVersion": "1.1.0",
  "compatibility": { "minimumMajor": 1, "maximumMajor": 1 },
  "profileId": "aoe2de-101.103.57257-rms-v1",
  "behaviorVersion": "verified-2026-10-28",
  "productVersions": ["101.103.57257.0"],
  "capabilities": {
    "exact-cliff": "complete",
    "exact-connection": "complete",
    "exact-elevation": "complete",
    "exact-engine": "complete",
    "exact-generation": "complete",
    "exact-land": "complete",
    "exact-object": "complete",
    "exact-rng": "complete",
    "exact-setup": "complete",
    "exact-terrain": "complete",
    "strict-parser": "complete",
    "source-catalog-v1": "complete"
  },
  "minimapPalettes": {
    "schemaVersion": "1.0.0",
    "derivationContract": "aoe2de-dat-minimap-palette-v1",
    "entries": [
      {
        "paletteId": "aoe2de-101.103.57257.0-minimap-v1",
        "productVersion": "101.103.57257.0",
        "source": "dedicated-dat-palette-indices",
        "terrainColors": [
          { "terrainId": 0, "highColor": 43264, "mediumColor": 3381031, "lowColor": 36096 },
          { "terrainId": 1, "highColor": 3169718, "mediumColor": 3169718, "lowColor": 3169718 },
          { "terrainId": 2, "highColor": 16304522, "mediumColor": 15250552, "lowColor": 12424815 },
          { "terrainId": 3, "highColor": 15968860, "mediumColor": 14983762, "lowColor": 14326889 },
          { "terrainId": 4, "highColor": 5542576, "mediumColor": 5542576, "lowColor": 5542576 },
          { "terrainId": 5, "highColor": 43264, "mediumColor": 3381031, "lowColor": 36096 },
          { "terrainId": 6, "highColor": 15968860, "mediumColor": 14983762, "lowColor": 14326889 },
          { "terrainId": 7, "highColor": 9079639, "mediumColor": 8554573, "lowColor": 7766593 },
          { "terrainId": 8, "highColor": 9079639, "mediumColor": 8554573, "lowColor": 7766593 },
          { "terrainId": 9, "highColor": 43264, "mediumColor": 3381031, "lowColor": 36096 },
          { "terrainId": 10, "highColor": 2454585, "mediumColor": 1406485, "lowColor": 29184 },
          { "terrainId": 11, "highColor": 15968860, "mediumColor": 14983762, "lowColor": 14326889 },
          { "terrainId": 12, "highColor": 43264, "mediumColor": 3381031, "lowColor": 36096 },
          { "terrainId": 13, "highColor": 2454585, "mediumColor": 1406485, "lowColor": 29184 },
          { "terrainId": 14, "highColor": 16304522, "mediumColor": 15250552, "lowColor": 12424815 },
          { "terrainId": 15, "highColor": 3169718, "mediumColor": 3169718, "lowColor": 3169718 },
          { "terrainId": 16, "highColor": 43264, "mediumColor": 3381031, "lowColor": 36096 },
          { "terrainId": 17, "highColor": 2454585, "mediumColor": 1406485, "lowColor": 29184 },
          { "terrainId": 18, "highColor": 2454585, "mediumColor": 1406485, "lowColor": 29184 },
          { "terrainId": 19, "highColor": 2454585, "mediumColor": 1406485, "lowColor": 29184 },
          { "terrainId": 20, "highColor": 2454585, "mediumColor": 1406485, "lowColor": 29184 },
          { "terrainId": 21, "highColor": 2454585, "mediumColor": 1406485, "lowColor": 29184 },
          { "terrainId": 22, "highColor": 19105, "mediumColor": 19105, "lowColor": 19105 },
          { "terrainId": 23, "highColor": 19131, "mediumColor": 19131, "lowColor": 19131 },
          { "terrainId": 24, "highColor": 15968860, "mediumColor": 14983762, "lowColor": 14326889 },
          { "terrainId": 25, "highColor": 15968860, "mediumColor": 14983762, "lowColor": 14326889 },
          { "terrainId": 26, "highColor": 10010864, "mediumColor": 10010864, "lowColor": 10010864 },
          { "terrainId": 27, "highColor": 15968860, "mediumColor": 14983762, "lowColor": 14326889 },
          { "terrainId": 28, "highColor": 3169718, "mediumColor": 3169718, "lowColor": 3169718 },
          { "terrainId": 29, "highColor": 9079639, "mediumColor": 8554573, "lowColor": 7766593 },
          { "terrainId": 30, "highColor": 9079639, "mediumColor": 8554573, "lowColor": 7766593 },
          { "terrainId": 31, "highColor": 9079639, "mediumColor": 8554573, "lowColor": 7766593 },
          { "terrainId": 32, "highColor": 43264, "mediumColor": 3381031, "lowColor": 36096 },
          { "terrainId": 33, "highColor": 15968860, "mediumColor": 14983762, "lowColor": 14326889 },
          { "terrainId": 34, "highColor": 43264, "mediumColor": 3381031, "lowColor": 36096 },
          { "terrainId": 35, "highColor": 10010864, "mediumColor": 10010864, "lowColor": 10010864 },
          { "terrainId": 36, "highColor": 15968860, "mediumColor": 14983762, "lowColor": 14326889 },
          { "terrainId": 37, "highColor": 10010864, "mediumColor": 10010864, "lowColor": 10010864 },
          { "terrainId": 38, "highColor": 15968860, "mediumColor": 14983762, "lowColor": 14326889 },
          { "terrainId": 39, "highColor": 15968860, "mediumColor": 14983762, "lowColor": 12440061 },
          { "terrainId": 40, "highColor": 15968860, "mediumColor": 14983762, "lowColor": 14326889 },
          { "terrainId": 41, "highColor": 15968860, "mediumColor": 14983762, "lowColor": 14326889 },
          { "terrainId": 42, "highColor": 15968860, "mediumColor": 14983762, "lowColor": 14326889 },
          { "terrainId": 43, "highColor": 15968860, "mediumColor": 14983762, "lowColor": 14326889 },
          { "terrainId": 44, "highColor": 43264, "mediumColor": 3381031, "lowColor": 36096 },
          { "terrainId": 45, "highColor": 16304522, "mediumColor": 15250552, "lowColor": 12424815 },
          { "terrainId": 46, "highColor": 16304522, "mediumColor": 15250552, "lowColor": 12424815 },
          { "terrainId": 47, "highColor": 1842204, "mediumColor": 1842204, "lowColor": 1842204 },
          { "terrainId": 48, "highColor": 2454585, "mediumColor": 1406485, "lowColor": 29184 },
          { "terrainId": 49, "highColor": 2454585, "mediumColor": 1406485, "lowColor": 29184 },
          { "terrainId": 50, "highColor": 2454585, "mediumColor": 1406485, "lowColor": 29184 },
          { "terrainId": 51, "highColor": 16304522, "mediumColor": 15250552, "lowColor": 12424815 },
          { "terrainId": 52, "highColor": 16304522, "mediumColor": 15250552, "lowColor": 12424815 },
          { "terrainId": 53, "highColor": 16304522, "mediumColor": 15250552, "lowColor": 12424815 },
          { "terrainId": 54, "highColor": 5542576, "mediumColor": 5542576, "lowColor": 5542576 },
          { "terrainId": 55, "highColor": 2454585, "mediumColor": 1406485, "lowColor": 29184 },
          { "terrainId": 56, "highColor": 2454585, "mediumColor": 1406485, "lowColor": 29184 },
          { "terrainId": 57, "highColor": 19105, "mediumColor": 19105, "lowColor": 19105 },
          { "terrainId": 58, "highColor": 21680, "mediumColor": 21680, "lowColor": 21680 },
          { "terrainId": 59, "highColor": 5542576, "mediumColor": 5542576, "lowColor": 5542576 },
          { "terrainId": 60, "highColor": 43264, "mediumColor": 3381031, "lowColor": 36096 },
          { "terrainId": 61, "highColor": 15968860, "mediumColor": 14983762, "lowColor": 14326889 },
          { "terrainId": 62, "highColor": 43264, "mediumColor": 3381031, "lowColor": 36096 },
          { "terrainId": 63, "highColor": 9079639, "mediumColor": 8554573, "lowColor": 7766593 },
          { "terrainId": 64, "highColor": 9079639, "mediumColor": 8554573, "lowColor": 7766593 },
          { "terrainId": 65, "highColor": 9079639, "mediumColor": 8554573, "lowColor": 7766593 },
          { "terrainId": 66, "highColor": 9079639, "mediumColor": 8554573, "lowColor": 7766593 },
          { "terrainId": 67, "highColor": 9079639, "mediumColor": 8554573, "lowColor": 7766593 },
          { "terrainId": 68, "highColor": 43264, "mediumColor": 3381031, "lowColor": 36096 },
          { "terrainId": 69, "highColor": 1842204, "mediumColor": 1842204, "lowColor": 1842204 },
          { "terrainId": 70, "highColor": 16304522, "mediumColor": 15250552, "lowColor": 12424815 },
          { "terrainId": 71, "highColor": 43264, "mediumColor": 3381031, "lowColor": 36096 },
          { "terrainId": 72, "highColor": 43264, "mediumColor": 3381031, "lowColor": 36096 },
          { "terrainId": 73, "highColor": 43264, "mediumColor": 3381031, "lowColor": 36096 },
          { "terrainId": 74, "highColor": 43264, "mediumColor": 3381031, "lowColor": 36096 },
          { "terrainId": 75, "highColor": 15968860, "mediumColor": 14983762, "lowColor": 14326889 },
          { "terrainId": 76, "highColor": 15968860, "mediumColor": 14983762, "lowColor": 14326889 },
          { "terrainId": 77, "highColor": 43264, "mediumColor": 3381031, "lowColor": 36096 },
          { "terrainId": 78, "highColor": 15968860, "mediumColor": 14983762, "lowColor": 14326889 },
          { "terrainId": 79, "highColor": 16304522, "mediumColor": 15250552, "lowColor": 12424815 },
          { "terrainId": 80, "highColor": 16304522, "mediumColor": 15250552, "lowColor": 12424815 },
          { "terrainId": 81, "highColor": 16304522, "mediumColor": 15250552, "lowColor": 12424815 },
          { "terrainId": 82, "highColor": 16304522, "mediumColor": 15250552, "lowColor": 12424815 },
          { "terrainId": 83, "highColor": 43264, "mediumColor": 3381031, "lowColor": 36096 },
          { "terrainId": 84, "highColor": 43264, "mediumColor": 3381031, "lowColor": 36096 },
          { "terrainId": 85, "highColor": 43264, "mediumColor": 3381031, "lowColor": 36096 },
          { "terrainId": 86, "highColor": 43264, "mediumColor": 3381031, "lowColor": 36096 },
          { "terrainId": 87, "highColor": 43264, "mediumColor": 3381031, "lowColor": 36096 },
          { "terrainId": 88, "highColor": 2454585, "mediumColor": 1406485, "lowColor": 29184 },
          { "terrainId": 89, "highColor": 2454585, "mediumColor": 1406485, "lowColor": 29184 },
          { "terrainId": 90, "highColor": 5542576, "mediumColor": 5542576, "lowColor": 5542576 },
          { "terrainId": 91, "highColor": 2454585, "mediumColor": 1406485, "lowColor": 29184 },